{
  "$schema": "https://json-schema.org/draft/2020-12/schema",
  "type": "object",
  "required": ["id", "name", "category", "description", "iconPath"],
  "additionalProperties": false,
  "properties": {
    "id": { "type": "string", "pattern": "^[a-z0-9-]+$" },
    "name": { "type": "string", "minLength": 2 },
    "category": { "type": "string", "minLength": 2 },
    "description": { "type": "string", "minLength": 8 },
    "iconPath": { "type": "string", "pattern": "^/" }
  }
}
